tweet,label
untung saja rapot orang tua ajak sharing paham aman nilai anak hehe sempet curcol rapotan tidak apa yaaa ku butuh tenang kutat dengan sop,happy
moga alloh meridhoi niat ya sayang mudah gampang lancar selaha niat ya sayang nant sabar ber istiar amin ya robb alamin url,love
ganteng tidak ih kesal sekali liat ekspresi dingin nya bawa karakter drama but helloo we re in real life presscon profesional ya nunjukin karakter drama salah lapak bro kasihan seohyun poor my baby,anger
haha pesona pesona kkk,love
desi sayang desi suka desi ungkap asa desi lepas pendam url,love
keren ya jalan mana mandiri sangat keren ndasmu memang lagi temennya saja kalau yang mah lurah ayo saja,anger
hepatitis potensi timbul dampak morbiditas mortalitas sakit kronis silent killer seram,fear
orang tepat belakang selang kalah suka posisi ya suka belakang tatap cinta belakang,sadness
pagi olah raga jalan sehat santai senam ringan wbs pstw bm ii jambar damping asn pjlp rptra kalijodo olah raga rekreasi nikmat suasana taman anak anak tam lansia sehat yes url,happy
takut pulang rumah putus habis malam supermarket pagi,fear
terkadang dapat milik orang menginginkanya apa beban tanggung gantleman dialog,sadness
si username enak dewe lepas tanggung backers dasar toc kickstarter sedia platform crowd funding creators backers toc tunduk hukum laku governing law si toc cari legal loophole nya url,anger
username minggu jumpa temu cinta member bayang bayang hadir sosok dengar lagu,love
username sianjiirrr suka sangat bikin kontroversi,anger
ya gusti coba cantik nempel sekali pala memang manjaahh dimanjahhh memang cantikkk sok cantikkk,sadness
mana selip do a punggawa super elja happy pssday username ale,happy
sudah ahok bui istri kangkang orang tujuh sekarang kjatuhan pohon plastik kasihan nasib,sadness
username kalau makan siang warteg belakang kantor andal makan situ adalah paket ribu haha smp bu haji nya tiap bayar bilang ribu makan mah yang kenyang untung tipe orang yang suka nongki beli a,happy
arab lokal peduli busana orang arab datang hijab orang asia bule pakai tanktop celana pendek mall,anger
memang benar yaa orang yang jahat ya jahat tukang selingkuh ya yang tukang selingkuh terus nikah selingkuhin jodoh cermin banyak ngaca,anger
cerita yang baca jujur kesal sekali baca sih poligami siksa batin memang tidak bisa adil dilepasin saja mbak istri mending pisah saja mbak hidup free as a bird kadang gengsi kalah hati,anger
yah kalau jalan bagus kasi saja alat musik kawan kawan beda servernya kalau teman teman servernya jerumus maksud hancur,sadness
iya nee gimana ya hadiah aduh bingitt,anger
darenya kalau salah pergi yang satu bikin pergi kalau sayang ya tidak mau sayang ya habis tidak usah main true dare bahaya,fear
ya lewat fanatik sekali risih lihat tarik okesip,fear
modal haha haha bareng saja jatuh cinta nyaman receh,love
username benar nang pas pulang flo untung fakultas keluar beda pakai kacamata biar gakenal begitu benar takut,fear
tumpah kasih sayang masakan percaya tiada masakan yang sedap dunia ini kecuali masakan air tangan tuju,love
tanggung tinggal dari ramona sari jawat aktivis salah juang tangguh username hak sehat seksual reproduksi perempuan indonesia moga maha kenan peluk pulang tuhan tuhan ambil,sadness
resign ko takut better rasa nyaman ko batin paham salah sih,fear
oldmoneygakngerasain beli dodol lipet bentuk suka bentung burung yang bunyi lagi bosan dodol kasih sagu terus mirip rambut nenek sihir begitu lol,happy
ragu bilang rindu kesal keubun ubun kode morse bilang ya bicara mari debat lupa habis senyum jatuh cinta,love
sungguh cinta berat pisah dengan hadiahperasaan username bikin baper sukses lupa lapar url,sadness
inayah k iyaiya sedih begitu,sadness
pancing bodohnyakan rizik bangsat cabul salah kaum kampret model bain takut masuk surga otak dimane mikirnya coba url,anger
santai pakai kaos celana oblong sendal jepit ribut kuncir gantung muka kucel modal laptop hp jalan sudahh lengkap syekaliii,happy
username kasihan fh bangun pagi kerja kantor pks terimah info kawan pks kawan bedah partai perintah aku partai kasih yah kampung,sadness
kalau yang apal orang orang nye teriak rojali tuduh yang tusuk saudara persija persijaselamanya url,anger
dokter lega sendiri pasien tengah bpjs anda rujuk stres timbang uang,happy
cinta usaha tampil cinta sejati terima lebih kurang,love
username nyata black campaign negeri miris ngeri oleh jabat hasil fitnah bohong,fear
komen min kalau posting karya orang tolong izin tag si milik karya feed balas coba dm kalimat komentar feed akun sebut,anger
username ridiella cantik sekali gemeees makasih sayang,love
degdegan gemeter hati tenang ngantuk ilang selera makan ilang gimana besok ya allah takutt sekali kalau sampek ngapain,fear
sekali komen dapat akun kpop begitu yang btsnya langsung serang netizen yang seram wagelaseh wkwkw netizen memang seram wkwkw,fear
tiket gratis nonton blitz ngajakin nonton ginidah angus,sadness
anjir askmf marah scroll saja takut kampret i m trying to sleep right here dkskdf bayang sekarang babihutan,anger
oh tuhan ku cinta ku sayang rindu utuh cinta hati,love
sekian kali getar walopun dampak gempa getar iru panik masyarakat tidur n tidur lapang,fear
generasi jara pacoa terik pagi antar pantai masyhur nama bima pantai kalaki pantai indah masa url,sadness
hati yang sakit sakit buat oranglain sungguh sakit marah ego kecendrungan salah orang,sadness
bismillah salam plur slankers i indonesia ketemu moment nanti jambore nasional slankers indonesia slank,happy
dear username jadi mohon kai ambil tindak jasa ka gambir semarang semarang gambir memohin tunggu bawah ijin tumpang yang turun url,anger
kemarin sore customer order grabcar username antar nasi kotak orang tua rumah alhamdulillah nasi kotak buka puasa moga rejekinya lancar ya mas cc username url,happy
username username ituh cewek disakitin saja tahan lawan lapor cinta kah postingannya ja url,sadness
terimakasih papap terimakasih terimakasih siaga terimakasih cukup terimakasih maklum terimakasih sabar terimakasih,happy
nemuin baca yang bikin bahak paragraf duh suka sekali saya tulis,happy
national monument monas bejarak sekian ratus meter kantor sentuh dinding pagar,sadness
ubah sikap tubir tubir ubah kayak susah ubah cepat hati happy anniversary sayang sayang sayang sekali username,love
cinta pahit ubah manis cinta tembaga ubah emas cinta ampas ubah sari murni cinta pedih obat,love
foto bikin ngeri alami merinding mati mata,fear
maksud yang dilecehin verbal mirip awak mbak via vallen saja marah semalu yang tahap perkosa ya biar tahap harus berani speak up apa tindak leceh biar laku pada mikir,anger
kemarin benar giveup dasnut materi quiz ajar quiz dar baca masuk otak benar modal doa pasrah benar pusing karena flu pas dapat mau nang,sadness
orang orang bilang sih yaelah jalanin saja tidak usah bawa tegang begitu ya orang tipe beda beda tipe orang gampang tres maksimal jadiiii lebih baik cegah obat usaha saja doloe,anger
secret admirer mah begitu instagram difollback doi saja langsung bikin umum teman teman mah doi memang orang suka follback follow ampe olshop difollback url,sadness
sih radikal booming radikalitas juang biar roboh terpa angin hanyut bawa gelombang pohon oak tumbuh lawan angin kokoh kuat semen roda recehkantwitter url,happy
jumat nonton inih tarik settingnya yang jogja penasaran telah baca bahaya laten acak rambut review kak username memang bagus sekali mata sembab karuan nonton yuk mumpung tayang,happy
zonasi kontroversi bikin sktm padahal mobil bayang sktm bentuk doa segera sj ajar buruk anak tentang arti jujur,anger
username username username semua laksana sholat salah satu bangun diri kafir salah satu gereja lindung allaah swt goda setan kutuk url,fear
oldmoneygakngerasain pasang raut pensil yang cermin sepatu ngintipin celana teman sekolah cewek,happy
bahagia beli paket segiga habis limagiga lancar internetan mayanlah wkwk eh alhamdulillah,happy
tipikal orang mesti dimaintain chatting terus sih tuh males ya when you got time please reply mine,anger
kali tanya gimana kuliah tahu semester masuk semester syukur ajak kompromi paham alami,happy
username min gimana kurir salah kirim alamat orang terus tanggung jawab gimana tolong respon cepat thanks url,anger
tidur cuci muka skincare routine haid mesti muncul jerawat ya beda rajin skincarean jerawat mudah atas long long time agooo jerawat bandel kali muncul muka url,sadness
username mimpi kali hitam ya om memang seram sih dipakein jaring bayang mahkluk yang nongol pekat,fear
serial komedi taun season cerita mba yang muda nikah duda anak kadang mantan istri ngumpul rumah receh sangat asli,happy
acha lucu pegang gendong dipaksain gendong x nang diam nang diam gilir ajak selfie kali kali ujung ujung nyium pipi kaget loh ante cha main sosor saja url,happy
paham mbak via vallen marah sekali dapat dm begitu dibully cewek yang bully kalau dapat dm mirip begitu dianggep puji kali ya kalau goda menarique ew,anger
ngeri yaa lalulintas untung bal rasa sih,fear
kenal nih langsung nyambung saja begitu sisi yang sok deket sama sok deket padahal kenal ae kaga nya welcone kek ilfil saja begitu ngeladenin nya,anger
beda pas kampung halaman prihatin tulis mohonantri saja serobot antri,sadness
kemarin rasa nama takut malam pas jemput ira bicara lebih baik ketemu hantu jalan nang saja takut karena daerah yang dilewatin rawan,fear
jam nongol eh jam ditelponin bilang tkp kost yang lantai kamar super gede lengang sangat tunggu waswas sms jemput,fear
saja sayang samaa orang ensenang jalaninnya orang sayang bocil si kibo taun ya,love
username temu lelaki yang sekian gagal dekat juang cinta calon nikah,sadness
bikin kesal kalau saudara tanya untung opname,anger
marah kelas editing ajar fotografi ajar sulap sungguh motret rancang hasil editing rancang yang atas potret karena,anger
dar idung meler terus waktu terawih tenggorok sakit yaps makan cair hehehe url,sadness
username benar final putus nya juni saya prlu extra hati gunain aplikasi prjalanan hotel maklum dana trbatas sesak kalau ad,sadness
ngebahas travel sama si eman buka luka rangkai luka yang agen travel oknum what the worst can happen to you,sadness
username username username username uang konsumsi buka puasa bareng anak yatim bayar katering,anger
pedih hati karena dzolimi jadi amplas sakti untuk bentuk yang lebih kuat tegar bentuk lebih bijak buat lebih kebaji,sadness
kuatir dukung penuh nu presiden username coba utak atik delegitimasi istilah islam nusantara kenal kembang nu muktamar soal agama politik,anger
mlz ngliat orang bicara komen dan lain kayak benar suci ampe zonk nanti nyinyir hijrah mudah hanya istiqomahnya yang susah iyee pahamm inti eneg saja jilbab an musim dulu kemane mall clubbing curhatanpenuh sorry,anger
cayo go go hahaha semangat a jenuh gila ajar kamar,sadness
hidup kejam anggap hidup tarung arena saing berfikir layak tani hidup ya cocok tanam harap takut,sadness
timpang sosial picak mata kaum kampret model memutarbalikan fakta tolol mikirnya,anger
bakso jeroan teh jahe panas pas hujan deras bahagia hakiki yang,happy
berangkat pagi ajar ampe jam langsung cus kampus pesan gojek kali karena jauh dari sekolah halte busway terus panas terik macet jalan lagi banyak tilang tj alhamdulillah dapat duduk jam jalan mac,happy
repot itu kalau dar baca erti nahh situ timbul salah paham selektif argument ndakk papa selagi nalar tetap jalur jalur itu langgar celotehreceh,sadness
ngimpiin dira almarhum bapak bicara bareng tertawa tawa tiga minum susu jahe angkring neng damai sekali,happy
cab olahraga username pencak silat salah cabang andal utama untuk raup beberapa medali happy olahraga beladiri tahun ajar silat sedikit sblmnya usia tahun tekun karate taekwondo,happy
taun jogja sekarang packing asa kemarin cicil bawa pulang tetap saja asa baju saja,sadness
habis intern jumpa deh senang sekali siapin topik bicara optimal minimum topik bikin emosinal abis nang tahan mcd too sweet to be true,happy
kapooook ketemu kumpul sama sepupu bangsaaat anjrit tipu korup saja belagu sirik dengki anjiiing lagi mampus liat saja rumah cicil hasil nipu lihat saja hahaha god never sleep,anger
username lebih baik ketua dpr berani tangkap banding anggota dpr gubernur rt berani korupsi yang berani tangkap,anger
jujur ya takut reaksi nya kaya pas sedikit sedih sedikit nang kaya apas anjink goblox sangat takut ngecewain tbtb mikir ko orang cengeng sangat si ko orang gin sangat si ajg ngamau,fear
username username hahahahah anjir sempet takut muka penuh rambut rambut halus yang numbuh gara gara aloevera,fear
orang minum obat tenang pandang belah mata minum bilang gila serah orang buah solusi,sadness
malam tonton belah pas lagu parklife sing along nya wasweswoswasweswos parklife,happy
kalau ya terima saja ngomel terus ngumpul batas begitu bikin macet manusia asli bikin ribet emaknya anak muda bapak santai langsung terima informasi treak tidak jelas ky pasar asli itu,anger
username nih manusia tibatiba nyita perhati gara kira orang kalem allahu bobrok sekali bobrok cinta huhu budak cinta sangat sori url,love
username alhamdulillah yallah kasih kode mah ngode spesifik langsung tag pancing,happy
diucapin happy birthday heran saya dasar kalender hijriyah ramadhan h saya lahir oke i accept that,happy
username username username sama saudara anjing cuuk jancuk hahahaha pribadi golong tagih gih sama orang hahahaha bonekselamanyajancok,anger
ganti presiden takut calon si doi yang onoh ih syudih,anger
lost kg in a month gara kerja bikin stres zaman kuda susah sekali nurunin kilo saja daku senyum perih url,sadness
ku erti teka teki mu kalimat indah ku sadar tulis ku sangka jatuh cinta mudah sahabat ku,love
kelas tertawa yandi nyeletuk bilang anak sd mah hahahaha orang anggap yandi guyon,happy
keren yang bilang username anti islam triliun hektar kampus rujuk islam dunia kelas al azhar proyek ponpes madrasah masjid fasilitas ummat kalau yang bilang beliau an,happy
allah masha allah allah kasih gunung dosa himpun allah kam dosa dosa kasih sayang maha agung wujud alam kasih sayang allah,love
username suka ku inya itu dingin orgnya sayang benar bujur lwn ina hiih kena ina tuh lawan buhan jelek tampan itu saja na wkwk,sadness
kasih yang ringan yah walo ringan iya adab bcr yang aku partai dakwah seperti,sadness
username username username pakai iseng beli yang paket langsung salah minimarket beli pulsa paket zonk bagi tidak diginiin nangispojok,sadness
lho yang gadang benerin majuin daerah pesan barang saja negeri padahal hasil rajin duduk lokal saja banyak yang bagus habis pikir deh gilir gin saja koar toko belah polah sedikit saja pedas tuh mulut diam saja,anger
daritadi tuh nang ngeliat foto tae ilangin mulletnya ya yang tidak suka sama mullet kalau sayang bts terima apa yang laku kalau kayak gin gbs lin lagi huhuhu sedih sangat,sadness
sumpah alah cowok malu alay bet ajak chesecake factory a lalalayeyeyeye,anger
itu beli shopee pakai atm manual cocok verifikasi otomatis eh enak teledor pakai akun sepupu otomatis pesanannnya kecancel ya allah malih ya henti goblok,sadness
betapa nikmat sate kambing bakar bara api dn bumbu cap no makan keringat hangat badan bikin darah keringat dingin jantung modar kemudi an,happy
keinget smnggu sblum kompre malam nang terus minggu sblum ukmmpd nang cemas takut minder kawanskrng doa jawab terimakasih yesusku,happy
rumah lantai deket tangga cium bau pandan nyengat sekali sana makan pandan takut,fear
saya saja yang bahak nonton username username sma ali mochtar ngabalin hahaaa simpul wkwkk bang karni ilcbpip,happy
gegara thread nya username kemarin tentang oldmoney vs okb sih oldmoneygakngerasain trending topic yaa lumayan ya recehkantwitter,happy
ngeri sekali gelombang tinggi capai meter hantam wilayah pesisir pantai selatan pulau jawa,fear
manusia yang tindak tanduk manusia yang paham salah salah dengan hawa nafsu,happy
ig line kasih line saja playstorenya biar paket ig line mobile legend,anger
orang oldmoney datang kandang pakai sederhana kaos oblong celana training keliling kandang pilih sapi transaksi capai m epic beliau orang taat ibadah royal anak gadis nga,happy
raacha karena bm tomyam nya tbtb mas yang nyiapin meja bilang muka kaya asing kesini ya wkwkwk mas nya saja,sadness
alhamdulillah happy mkin aktif anak monthdedek nazhiaputriadhitya sehatterussayang cintaudek,happy
bahagiain orang bahagia yu ya bahagia orang bahagia bahagia kali lipat,happy
yang datang hidup ibu karena puruk datang dengan hidup yang jawab dptkan dari ibu hadir disaan jauh tinggal kusendri dari hidup,happy
dukung doa sikap pilih upaya tahan bahagia lihat sedih kebahagianku pudar terima undang nikah,sadness
lagu kayak hits enak sih ensenang just give me a reason by p nk at kara s rom,happy
malam coba bikin overnight oat yang kadar pisang lebi oatnya tidak lupa tambah chia seeds madu vsoy moga sahurqu manis angan angan url,happy
username username alumni praktik kampus ijin harusnyakan ijin karena alumnus pakai fasilitas negara tuk penting tahu otoritas kampus,anger
haha kasihan kepada akun sembuh sakit dendam sepnjang kerja usilin anies kira anies aware egp padahal konco banyak yang insaf yang tunggu struk url,anger
masrakat nelayan kbt merauke papua resa gelisa karena lambat surat surat dukumen kapal nelayan bak tahun masrakat nelayan menbayar mahal juta ditanba marak pungut liar,sadness
hah benar ya kalau benar astagfirullah masya allah naudzubillahminzaliq partai islam partai allah laku setaaan url,anger
benar badan sehat bawa makam susah keringet dingin pagi bawa sehat d bawel acha karena janji toilet x tahan kalau tahan hmmm,sadness
username ya bias saya bikin saya kadang lupa kalau saya butir debu tuh benar bikin saya spesial saya sayang sangat sama,love
senyum ramah lohh fansnya angkuh rodo ngadoh piee ngono nek rasakne sumpah wagu mas polah,anger
inshallah kalau saya rejeki foto bareng tom saya kasih atur ina inu ribet saya post kesini pamer bagi kebahagian croplah komuk saya suka hati url,happy
kemarin hs memang benci sekali kangen gegara masuk kamar poto sebell plesbek minggu nonton liat meme,sadness
biasa twitt pakai english but thank you username for pakai it easier to watching them url,happy
anggap invisible rasa intangible enggak harga wujud skripsibaper kapanmarineeeeeeeeyaallah,sadness
repot itu kalau dar baca erti nahh situ timbul salah paham selektif argument ndakk papa selagi nalar tetap jalur jalur kalau jalur itu langgar celotehreceh,sadness
mahar urus partai bawa islam islam agama yang indah cinta damai partai cari mahar,anger
terimakasih sayang sungguh sesal detik ketemu yang syukur benar kaya cahaya hidup makasih baby,love
okay kesini pindah nyata bahaya nih benar perhatiin omong takut jadi,fear
username username perintah layan rakyat tugas rakyat sejahtera aaaahhh biar allaah swt azab sebentar in syaa allaah swt url,anger
aku asa sesak terima undang nikah mantan mantan saing mantan gebetan mantan pacar manatan teman mantan mantan,sadness
hibur baca deh terus baca twit receh oldmoneygakngerasain hidupque remah rangginang manusia makan kiefsi saja oge meni hayang pamer story hahaha aque maloo username username url,happy
sayang lemah harga wkwk memang belum rilis sih harga liat video dibandinginnya hp huawei porsche design yang mahal iphone x kaga hp akan laku kaga indonesia,sadness
ayah nyokap kasih thr begitu anak sedia snack coklat bungkus begitu bagi halloween amrik begitu,happy
ngehujat saja biar sexual harassment rajalela goblok dilecehin suruh marah tolak maki maki ya mempan laku sexual harassment via vallen pengaruh karir si simic ya resiko simic goblok,anger
wartawan bunuh guru bunuh aktivis bunuh sorang bunuh bas orang bunuh puluh orang bunuh ratus orang bunuh ribu orang bunuh puluan ribu orang bunuh ratus ribu orang bunuh juta orang bunuh,anger
bual main klaim bagi gunting pita sahaja anggap puja bangun nomation cakilrakyat,anger
bumi menang egois eksplorasi kaya alam milik serakah tanggung selamat lingkung hidup dunia username url,sadness
username kecewa akulaku daftar acc cs suruh pakai nomor saja acc ganti kali nomor saja acc tutup nasabah,anger
username selamat siang sahabat pos mohon maaf balas kirim sebut terima ya sahabat terima kasih percaya layan fd,happy
negeri diri akal sehat politik orang marah akal buntu mari turun kampus kampus rawat akal sehat sedekah bangsa tunggu apbn,anger
ya gik percaya kalau suami keluarga suami pikir nya beda dianggep berontak karena nurut suami,fear
bege paham sih kasih peluang ko ya persentase kurang inti gin saja si dapat informasi karena rajin hak yang rajin biarin saja usaha cari,anger
khawatir bosan jalan pulau bal indah alam manja pandang jalan ayoramaikantengananfestival,happy
ya allah moga manusia super hero dpr,fear
malam checkup darah oke warning tensi kolesterol pusing ya dok spertinya gejala maag oh begitu ketik nyruput kopi,fear
eh numbuhin brewok nyenengin sih compliment cowok bonus rawat sedikit langsung tumbuh liar gatal sekali,fear
pm banging jam am tidur bayang qualify time tiga salah alas rindu pulang,sadness
entah pikir ubah kalau pikir share yang gila pikir x tulis twitter ig jempol netizen kalah,fear
nungu bis hahaha enak tol kebon jeruk tomang,sadness
ya allah bangun tidur bau yang masak tahu teman bule masak cupu sekali kalau mokel gara gin saja ditawarin sih sama si bule hmmmm,sadness
kuat cinta tak rapuh hapus ruang percaya setia pada sayang,love
lebi goblo pas egi tinggal pas masuk kelas pamit tementemen tahu tidak ada mbak sisil sudah syok seperti ku mimbik mimbik ngekek goblo si,fear
bangun infrastruktur rakyat rasa hadir negara hidup kerja nyata username perintah depan tetapjokowi tetapjokowi tetapjokowi tetapjokowi tetapjokowi tetapjokowi url,happy
kopi semangat kerja yuk aktivitas,love
jamaah masjid al tsar nasi tumpeng ayam matang aji tafsir masjid al tsar aju aya aya wae ramadhan berkah,happy
username dikirimin kue sma teman pakai jne minggu sampai terus ganti sma jne nya kirim minggu sampai basi kue nyusut telah kapok tidak mau pakai jne,sadness
egois ku tutup mata telinga hati bimbang ku acuh asa cari yang sangat egois pikir yang bagi salah,sadness
ya gin yang takut layan nya ambil orang heiii layan tuhan sapa yang tuhan percaya aneh pakai main fitnah jatuh orang ya,anger
username iyaa nci kadang suka mikir hidup ingin yang esok masih kasih nafas allah mudah selalu lindung aaamiiinnn,fear
anda jokowi kalah hati bangsat bangkit teroris bangsat bangkit radikal bangsat bangkit politik balas dendam bangkit yang minoritas tekan mending pisah nkri tetapjokowi,anger
orang dukung khilafah black mail username username username username username username username username username username username username username username url,anger
username wkwkw seperti iya deh ingat kalau sepupu sepupu nyambung seru ngobrolnya pasar kalau sama saja hahaha oiyaaa wr supratman,happy
username apa takut sama itu hewan trauma gigit abis rumah sakit gegara racun gigit anak begitu buset langsung pusing lemas ampe ngeliat hewan langsu,fear
teman beli hp online dari batam telah trf hubung bea cukai bahwa hpnya tidak bisa karena bilang bm kalau bayar sampai jam sore polisi eh benar trf teman modus tipu karena barang url,anger
semangat sayang tunggu anak yang lahir ahahahhaha username exo comingsoon exo exoplanet weareoneexo,love
kangen luk dua tunggu cinta sayang username url,love
username hadir min salam saya segmen salsa icikiwir to long bacain ya username username username trimakasih,happy
pulang tinggal lupa hawa hawa freet freet kamfreett nada pesan bunyi sms masuk,sadness
desa tesbatan kali kampung halaman ayah sangka area sawah bagus maklum saja mampir desa tesbatan amarasi mentok,happy
bayangin ya suka sama paksa suka sih duh mah kaya begitu drama suka ya biarpun banyak duit mah suka mah suka saja iya sih,anger
mati lampu rumah sudah ky kuat kamar nyala saklar wq sumuk aseli liga la familia yang betah panas kudu turun nyala saklar gelap,sadness
iya sih dosa sama tetap cinta muahh,love
ingat nonton gayem tempe mendoan persis joget asik sekali kaya boneka mampang,happy
kemarin mampir ngopi coba custom shop nya ensss gitar nya guitarforlife pondok labu url,happy
username username coba jabat username yang laku indonesia segani bangsa bangsa yang segani indonesia,anger
politis oposan jokowi bangun jalan tol hasil otak kosong lupa juta mudik lebaran nikmat mudik cepat terima kasih jokowi calon potensial pilih jokowi berfikir,anger
ih ngeri edar foto luna maya suzzanna bikin merinding url,fear
umur hidup kali keluh call center respon doa terima kasih username,anger
karena gambarin karakter anime bilang sifat saya lihat matahari sore dua sekolah saya kelepek kelepek,love
pikir bikin warung sate ayam edgy alih alih ngejawab oke customer pesan bang sate porsi ya lanjutin tanya tingkat matang rare medium well done saos orginial bbq mushroom cheese lada hitam pakai nasi mashed lontong,happy
terus pas ampe staisun nya lagi nih beliau marah karena pakai gopay yha bagaimana yak suka atuhlah ya payment via karena takut langsung kabur saja masuk stasiun nya,fear
ngeri sih ya memang akun gede followers ribu tuh kalau ngetweet yang jelek salah sedikit yang hujat langsung takut unfollow saja please,fear
wajah jokowi apa sih yang kliatan cina nya polower nya si botakndut mustopa yang nuduh p jokowi turun cina lagi stress urus kantor stalking hihi,anger
hilma teman adik kemarin main k rumah curhat mbak telat yaa padahal lebaran tmnku kalau minum sangobion vit b langsung dapat ya ku bilang coba saja kali untung hil padahal mbatin hmm telat coba,fear
seram kang kalau macet tol yaa horor mah,fear
terus mbatin ya milik baru tuh mas ganteng cafe tar pakai main cafe mirip ku janjiin,sadness
wanita jatuh cinta nya tertawa tertawa cinta,love
tidak tahu anjir takut gemeteran paralyzed tidak bisa mikir gila sih saya ngeexpect saya kaya begitu terus saya sama teman teman saya cuma panik sama,fear
misi mas numpang ngamen buat rasa indah jatuh cinta indah cinta milik makasih kalau tidak punya receh pakai cinta tidak apa mas username url,happy
