tweet,label
kasi presiden jujur tolak kasi presiden jujur humble tolak jama orde biar ngerti yang bisan ngelu presiden ganti,anger
suka sangat dengan username serta dapat enak lagu pukau bikin merinding juri top sangat pokok suka sangat program username juri serta memank,happy
ah emo anjir asa mahasiswa saja cemas takut bayangin depan kek gimana lingkung yang benar orang daerah moga ngejalaninnya,fear
username kadang tuhan tuh jadi rencana hasil tuhan usaha hasil once usaha accomplished tugas hehe semangattt mia abis lebaran buruk,happy
orang klub pb jaten muda anjur fokus badminton ayah ngotot putus masuk sma teman dwi sulistyono masuk smk lepas jarang pasang jarang latih sibuk ngutik motor,sadness
ooh allah manusia dangkal pikir fakir ilmu sok ampun sikap hendak mu url,fear
username kasih minyak tawon begitu hari nya dibiarin matang kalau tuh diletusin biar darah kotor nya begitu ngeri,fear
hai selamat pagi jelang siang semangat jalan lupa awal dss ya god bless peluk kali saja dingin kangen juleha,love
username nyerang fansite suruh take down foto pas konser suruh fansite tutup saja kalau fansite tutup ya sumber atm tutup hahaha,anger
orang yang gagal d laluny orang d benci allah hanya prabocor karena otakny bocor bocor bocor pengikutny ap lagi otakny moter username username username,anger
username ear biscuits kalau random invisible for architecture and design podcast oh lupa dengerin yacult spotify lucu sekali wajib dengar,happy
seru sangat manusia banyak hubung sama manusia yang seru sih seruuu kadang ngebingungin tidak enak ya mau gimana lebih ngontrol lepas tangan benar sembunyi yaudahh dijalanin one step at a time saja,fear
heads up warpaint bandnya si mbak t kalah kece walopun lagu ngepop mainstream yang bikin kece mbak luntur suka sekali so good whiteout sama the stall url,happy
mandi lanjut makan pagi wbs pstw bm ii jambar wbs total care makan pagi bantu pjlp tambah energi badan segar sehat stamina jaga,happy
panoramacantik bareng lia sobat cantik cewek rumah suka pakai sunscreen cuek saja ya pakai jaket saja yahh lindung kulit tubuh papar sinar matahari biar kusam,happy
username pakai arkana tidak bisa main diajarin ingat set nya ti dendi miracle and etc tadu sore abis streaming eh tanya ya,sadness
uwwhhh happy one month with unnieee moga ketemu nde sayang moga keluwarga yang samawaaa wkwkwkwk sarang sarangeyooo,love
cinta hebat hebat dunia kawin doa tutur cinta cita cita capai,love
username hihi seram sekali ya juur sih percaya begitu begitu jujur kalau ngrasa takut transrumahuya rumahuya,fear
kebutuan jelang lebaran desak beli harga sembako pakean nya serba ganti bandrol harga ya moga sabar hati kita buru hawa napsu setan yang tanggung,sadness
username ngerti nanganin ngamuk sayang suruh ubah orang sabar erti orang maju yang macemin,love
username sangat sih yang tidak mau ajar sejarah sejarah dunia ya begitu saja muter situ miris orang yang anggap saudi us kubu yang bersebrangan,sadness
revisi revisi ya allah mantap sekaliiii memang diginiin miyah nih biar pintar biar nggarap cari referensi hohoho,sadness
tinggal dijakarta mana masyarakat sana paham antri tulis mohon antri paham budaya antri mana,happy
liat vlive kemarin do megang hp jae jae megang hp do seram kalau screennya locked buka lock hp pakai fingerprint seram,fear
alhamdulillah kurma panen tanah arab saudi panen pekanbaru riau,happy
inti thread benar ngucapin selamat tanggal bagi sayang sabar ngadepin nyadar kado natal tuhan username url,love
hahaha duh nad saja sih sampai serang fans kencing saja belum lurus kaga eksoel jaman teaser ibu episode jaman lengkap,happy
banyak mnm air putih malam y ma tambahkn garam supaya tensi mama abs tuh langsung istrahat saja lh y besok pagi mama check up k dokter supaya lebih pst diagnosa n pengobatanny get well soon y sayang,love
satu yang bong hahaha habibie copot jabat prabowo ulah si wiranto wiranto pakai habibie pangab tragedi yang tanggung pangab bong bongak tembak polisi,anger
lorenzo puas lakuin rossi juara ducati honda untuk juara pabrikan syukur juara dunia,happy
teman lupa argh,sadness
kuat tidak iman doi jatuh cinta cinta tuh ngeri bikin korban iman cintaaa,fear
beda ketemu papas sapa pulang orang bilang tengkar tidak malemnya terima chat yang isi si geblek haha,happy
si username nalar sehat fans persija nyanyi dangdut seronok goyang via vallen sopan url,anger
saja timses jokowi anies bangga gilir dukung oposisi perintah hujat politiksubjektif url,sadness
username cinta cinta cinta cinta cinta cinta cinta cinta cinta cinta cinta cinta cinta cinta cinta,love
username username kalau yang jakarta jago nyembunyiin bukti usaha offshore yang bikin nama muncul panama paper jago sekali temuin bukti,anger
ajar harga perang saudara palestina israel saudara asih sayang bunuh lanjut provokator tiga menang belah perang raih menang nama tuhan perang,sadness
sumpah ih warga negara thailand saja pas bencana nasional kek gin bantu tuding bacot asa benar sosial media bawa penting politik musibah ditunggangin penting sampah berag,anger
klikbca seringkali susah sekarang internet masalah bilang omong kosong karena buka website,anger
nampak lelaki lurus innocent tipu habis buta asa cinta sayang,sadness
lihat belakang terkhir kali juang titik seperti malas memang belum buka pintu yang kunci takut yaasudahlah jalan hidup,fear
liat saja yah now fokus cari duda mapan dewasa ajak nikah n nyokap resin n kasih hak bagai anak kandung dipestain mewah kog saja langsung suami stay negara soon harus capai,anger
bos punya problem solving bagaimana begitu ya akar bagaimana ya instan tar rusak rusak begitu saja teroos,anger
nang gara solat maghrib nya telat isya solat gara partner kerja yang istirahat duluan sangat istirahatt nya yaampun sedih sangat hati,sadness
hebat mardani saya oeang mulut saja fakta belum capres lagipula koalisi pks gerindra yaow,anger
momen istimewa si atap kadang kumpul sederhana bareng sobat makna temankobong pagingopi,happy
langsung blusukan presiden jokowi simpul citra kerja pimpin ayom rakyat jokowisekalilagi,happy
hidup zaman presiden hebat soeharto beliau aman tenang masyarakat tenang kaum pki kaum rampok kaum bandit kaum yang jabat negara otak kosong kaum yang suka soeharto url,anger
muak lihat tingkah anak anak tingkah suram ya,anger
ketemu narasumber nyebeli kalau blokir aatu narasumber yang maksa liput ato liput cepat ditayangin jadwal nya mas mbak,anger
cowok yang hasil usaha patut suka harga yang hasil,anger
style kuliah doyoung kek gin simple gaya bikin jatuh cinta pokok doyoung cocok gaya saja anak ekonomi prody sastra inggris ngejemput selesai kuliah url,love
parungpanjang hadir juta debu yang warga dampak ispa jiwa percaya data nya puskesmas main kesini username username username username username url,anger
temu undur bebas visa undur memang sih negara php tingkat username username username username,anger
bukti contoh buat yang nakal ayo bang do more talk less while leading,anger
tak ragu besar kasih sayang tuhan yang momen sulit yang hadap hidup karena cahaya hati redup kasih sayang yang cinta yang lentera tuk terang,love
username kartosoewiryo taat agama bunuh soekarno bunuh sayyidina ali solat subuh hafidz quran ahli fiqih ibnu muljam bro,anger
ku rindu bisik mu telinga seraya moga kelak anak yang guna orang moga sayang orang tua mu,love
senyum senang hati lho kudu senyum lokasi potonya ngampung hotel dafam lotus jember,happy
username min mati hidup terus mati lagi gin listrik ngerusak alat elektronik belum benar tuh jan nyala dulu terus matiin lagi rusak elektronik nanti,anger
lokasi kamar lantai hujuuung protes berisik sekali anjir kost an ulang tahun siram siram,anger
abis fotocopy jilid gelontor dana juta si owner hati tawar tumpang antar rumah waaaah alhamdulillah,happy
sayang waton seram,fear
bingung diam tidak panggil dengerin benar nafas anteng sekali eh nyaman bantal guling kasur,sadness
username begitu pokok mama sabar sekali kalau libur smt gin suka tidur bareng mama wkwkwk selera fashionnya bagus simple ribet feminim abis kaya anak bawel sholat sama sehat aduh t,love
suka cewek beda kelas kelas a si cewek c kalau lupa untuk cinta pertama,love
buka bisnis contoh teman yang jatuh sebut mr b ngeri dengar cerita teman yang tengkar cekcok dengan istri perihal uang keluarga kondisi sekarang buat ngeri untuk resign bujuk rayu setan,fear
kalau foto profil vulgar y oke tidak apa apa foto selfie close up begitu leher saja sedikit ngg lihat dada pakai kerudung,anger
polri tambah anggar t gila lhaa nangkep laku yang sakit fisik novel baswedan saja sampee skg lhoo kabar sudah penjara belum nangkep koruptor tuntas koruptor teroris ekonomi parah akibat rakyat sengsara tahun tahun,anger
username username username username username username username username gin lho mas amal nu tahlil ziara kubur yasinan bilang bid ah sesat kawan kawan kadang lawan disk,sadness
ku prepare maksimal pakai receh khas anak sekolah macem orgnya boongan keluarga lagi butuh yaudah kasih yang janjiin balikin ekspektasi kadang suk,sadness
username tidak beli barang mahal happy cari sesuai budget hati hati pakai biar awet ganti ya kalau ilang rusak,happy
partner tidur waktu bal dapat tempat spesial bentuk rumah gazebo terus kolam renang pojok haha spesial sangat ya btw see,happy
username username username username terus memang klub numpang begitu pemprov hahaha stadion pribadi manajemen baya kah persija sewa gbk kenapa ribet hahaha jancoook jancook,anger
nasip adik niat daftar poltekkes pergi pas tes ngasal isi tidak ada harap masuk situ ujung terima hanya jurus sehat lingkung bidan,happy
pagi ajar harap langkah hidup,happy
tipikal cowok menye menye sangat ini ajak argumen salah orang keluh ini manusia maha sempurna pen ngatain goblok puasa,anger
sayang manusia tolak datang cinta pendam utara perhati,sadness
username username username kalau cewek tuk kasih rang orang nih cowok yang suka gampangin cewek biar ciwi luar sn yang waspada kalau yang memang suka digituin ya serah ya orang populer yang bikin sep,anger
jenniku sanagat cantik nan gemas bayi sayang sekali kamuuu ps imutan bayi url,love
dunia keras hadap lembek ya hidup,anger
moga pa username sadar bupati purbalingga pdip kena ott kpk warganet allah tunjuk mahfud partai lahir koruptor url,sadness
mertua nano nano sangat cari rumah kredit susah sangat posisi hamil anak kadang bikin emosi turun ken mandiri,sadness
tiba hujung simpang hujung jalan cinta dua paksa ku rela daya ku halang kerna ku cinta milik,sadness
username username username username username ngeriiiih bang takut d lepet dari doi type ya lekong pilipin,fear
cemburu bahagia bahagia kasih salah paham asa paksa sudah,sadness
hubung mempunyiai tuju hubung cinta pasang kasih tuju meni serius cinta bukti pelamin,love
yang bahas tinder paham karena penasaran download eh pas download dalam hati bilang aplikasi sesal langsung download baca deskripsi asik orang tidak,sadness
tidak batas chatan or main saja serah karena larang sempat orang bohongin tuh gede serah yah ensenang saja jalan hubung iniw,love
terkadang teman butuh keluarga tanah rantau thankyou for being my second family here guys tertawa puas jaim,happy
username monggo baik krl jurus bekas cikarang bogor tanah abang hutan kuat menang cc username username username url,anger
mudah puasa kali bawa ubah jatengsaruratkorupsi jatengsaruratkorupsi jatengsaruratkorupsi jatengsaruratkorupsi jatengsaruratkorupsi jatengsaruratkorupsi jatengsaruratkorupsi jatengsaruratkorupsi jatengsaruratkorupsi jatengsaruratkorupsi,happy
username min tanya salah buku pajak ppn nyata pph minyak bumi seperti gambar brikut solusi bagaimana url,fear
otak kalau memang goblok mau ajak bicara mana yang menang kiri kanan salah yang salah kecuali ngikut benar kadang itu kalau masalah yang disalahin serah deh,anger
abis sahur sembahyang subuh balek tidur bangun jam ruang jam menit sptinya apresiasi karena dapat mandi seragam pakai bedak sama gincu jalan dalam menit,happy
fyi ku temuin stasiun kondisi badan dingin muka pucat kayak makan bawa kantong plastik isi air minum ukurankecil,sadness
sempet swafoto bareng sinetron komedi top tukang ojek pengkol mang odih alias om kusye yang bangga si om saksi wakil perempuan keluarga url,happy
alhamdulillah kumpul sayang moga ad waktu yang temu amin indramayu,happy
korupsi kaya revolusi mental galak pakde username mesti ulang jokowiperiode url,happy
pas gym eike nimbang timbang tanita nya pas eh nnya eike bilang instruktur karena body eike cucok eh langsung donk member body kaya kwkwkwkww senang inspirasi orang,happy
menung ekor rusa karena juta ragu hampir bimbang gundah iring takut kecewa sisi gumpal percaya sisi takut kecewa ya tuhan,fear
tbh niat bikin short thread about child marriage hubung lumrah masyarakat habis bahas sekian,sadness
yaa konteks saya bukan benar dn benar sbuah proses sempurna mnerus hg tuj bangsa yang diinginkn makmur sejahtera online karena shrsnya semua sepakat dn konsentrasi,happy
username same orang ekpresif susah ngungkapin asa syukur sayang sekali keluarga sahabat pasang,love
cinta pertama yang ubah fisik yang buat rasa sakit lahir yang yang beri gelar,love
gimana hadap dosen dichat ngeread saja responnya sekali bingung ngapain takut salah langkah,fear
eling sih nih cepat kilat sekarang lambat sangat instagram refresh twitter gimana nih bosan nanyain nomor terus lambat username,anger
makasih deh get well soon kaocha ngantuk capai gel mual pusing muak pft,sadness
odong bohong odong haha woy adi bawa krts,anger
ataauuu yang rumah jelang lebaran biasa orang orang jelang lebaran ngapain saja duh cerah mention,happy
username bismillah happy bday kak wuatb gbu moga limpah berkah rezeki bahagia umur manfaat sukses dunia akhirat moga cita capai bangga orangtua nusa negara agama amin btw dom kak,happy
sih ngiler lihat duit umat limpah mudah tumpuk kecuali orang kuat iman metro tempo co amp ketua baznas bazis dki ilegal sandiaga uno jelas twitter impression true,happy
siang bodoh cafe tempat hari lewatin pulang sore museum macan kirain mah lempar kolor kantor kostan pacar hahaha ku dodonk,sadness
angin sih kadang tindak kadang tidak konsisten fair yang fair ya pmlik mbl yang pas parkir situ tindak kitu sanes,anger
foto dua cuma foto happy blessed day guru bonar sihombing umur sehat senantiasa kati,happy
rasa yang alami sana tekan ya tekan sana malu takut bodoh,fear
putusin dikatain nyumpahin mati rebut waris kaga tetap anak ce kog harus suami yang ajak tetap negara impi kanada capai kog tenang saja sabar jiwa,anger
orang orang yang abis beli bedak baju skincare aksesoris paket dan lain beli apa wes memang sih bikin status instastory,anger
nang pundak pilu sungguh,sadness
merinding takut ya takut jebak imajinasi diam diam hidup hadir orang yang sadar,fear
parah sekali sih sumpah ngebayanginnya saja seram sekali pikir temenmu langsung tanggap sekali hebat kaya cengo,fear
perkara yang lebih handal harga jaga nama buka dengan yang bercengkrama tipssore wit,happy
idm gimana sih halus untuk bilang teman toxic takut sakit hati kasarin teenchoice choicefandom btsarmy username,fear
marah papa masuk kamar banting pintu ketuk pintu bujuk marah mama,love
salamsaum bangga username raih opini wajar kecuali wtp dari bapak tahun hasil kerja keras semua untuk wujud tan yang bersih integritas pihak kepada tani amp,happy
talha ra mati mati usaha ngelindungin rasul saw riwayat talha ra bekas luka perang uhud masyaallah cinta nya sahabat rasulullah saw rela kasih allah sakit,love
libur lebaran tuh cepat gendong cerrier pakai sepatu terus pergi ketemu alam damai dengan,happy
rangin intensitas kabar kabar yakali sekali begadang face time telpon kantor tidur nama juang det ya tidak begitu sih bejuang konyol,anger
minggu username username layan yang langgan setia dm dm kalau lanjut nya bahas timeline yang ngurusin dm tidak benar balas nya url,anger
kenang sma pulang sekolah pulang uang teman cewek ribu bilang bensin nyasar warung nongki beli udud hahahahah,sadness
cinta this pic terima kasih indah note abai muka kaya babu pantai legon prima anyer,happy
sayang sekali liat mirip d laku adil saja nang wkwkw sih benar sayang mgkin karena liat n juang sayang sekali ikonic url,love
negara pikir gimana kembang hidup jagat raya yang luas orang pikir yang habis energi tenaga buang sia pantes negara tidak maju ngeladeni yang kaya gin url,anger
username gaji pns cair kabupaten siak syamsuar menang gubernur minus syam jabat siak gaji telat tunjada telat,sadness
masjid anggap muncul radikalisme pola pikir bawa yang sekenario akan oknum umat islam yang radikal sadar perang pikir kaum sekuler kita aa gym bawah terorisme mustahil lahir agama url,anger
ya allah tular orang genre musik a kek giniehh lucu sih lagu bagi memang manjahhh ingin manjahhh,happy
username username begitu muka ahahaha kemarin kalau taehyung oh kita menang jimin anjir hahahaha tengil sangat muka,happy
so soan ngeprank sih keseel panas tiris kunaon lagi meni tahan ngediemin,anger
gub username kaco manusiawi mknya pantes dapat pengharhaan penjara bukti username url,anger
mbak erning telusur saudara tolong gila laku rumah,anger
pagi surabaya mendung sekali biarin meger kuasa jiwa amp,fear
kelas emerson begitu laku kerna kebencianya lupa yang diketawain junjung son son gagal maning,anger
sayang nerima jelek baik tuh no drama anti sekali oramg tengkar sama teman percaya tidak we never fight,love
bingung orang bilang ganti presiden sih its fine calon mumpuni jokowi nyata memang belum lucu main politik golong ngusung prabowo sekuler,anger
pda akhrnya suami mmng tobat berani saksi tntng kelam mmng sabar istrnya sj langsung main cerai atau mmbalas prbuatan suami,happy
anak curah sayang harap takut hilang peluk rengkuh tengadah wajah langit sayang sengit selamat anak,love
username username geli memang isi kitab lempar lempar koin geli dinosaurus beruang kutub kecoa hasil evolusi bakteri sel tunggal,anger
dar coba sempurna panjang durasi sajak detik sajakrindu diam tanyajawab janganpergi,sadness
rindu ujung hati cinta ilusi tepi cinta singgah hati salah pilih tahan tahan siksa,sadness
mngkin wajar kalau orang islam kesal dengar cewek busana minim tengil bicara pakai bahas arab bahas sebut bahas yang sakral orang islam dipungkiri kalau orang arab semua taat wajar tabiat begitu dengan bahas arab bahasaarab,anger
username username dana endap bukalapak gara beku bukalapak bukti kirim dagang kirim barang pesan beli beku,anger
rapot batin haha nih indikator percaya teman bimbing sisi ingat cambuk kalau krisis percaya hehe,sadness
ya elah kog hidup tngh kelilingin saudara mama yang jahat siri gila jahat dengki bocengli najisin sangat sudi tetap harus pindah kanada sama hubby yang mapan n mature donk,anger
maha dahsyah allah cipta mimpi detail hinggal tanggal detak jantung bangun takut yang asal mimpi,fear
bagaiman kabar jantung mbak mbak yang megangin micnya tahun dari jaman saya sma saja ngena heran saya mudah saya jatuh cinta canyol,love
sungguh bejad anggota dpr wakil rkyt bayar dengan uang rkyt salah aparat densus dukung teroris,anger
ah sayang pilih pergi siap cerita indah lanjut hmm tulis handal shijin,sadness
tamsil islam nusantara tiang pancang gesa gesa kemarin sore pangkal dangkal dangkal tanam engkau takut mati angin milir segar caci kutuk,fear
si dera saja akun alter suka flashing her boobs once in a while bilang merinding ngeliat siksa siksa yang saya alami ahahaha url,fear
lepas alam asyik stadion terima kasih besar warga bantul amp,happy
sayang,love
yallah yaallah scrolling ig saja ngelag kea buka pakai internet explorer saja ah rasa ketidakstabilan sistem ig yah ntut bicara,anger
umur cita cita usia erti privilege masyarakat milik penuh butuh hari,sadness
eh pas minggu nunggu tik takut salah nulis alamat salah nulis nomer rt rw nyasar rumah orang curiga tetangga belah doi dikirimin hp tidak tahu parno hp hadiah,fear
username no telepon dari kemarin useetv saya layar blank tolong dieprbaiki tolong kirim teknisi lapang saya tunggu jam tolonf konfirmasi saya harus pergi kerja langgan suruh tunggu i,anger
rela pergi pagi temu mu rela pulang malam tani mu alas jalan sayang untuk ragu sayang cinta ku untuk biarine jalan url,love
kasih tehaer keponakan baju biji celana biji koko sestel jaket biji juta pesan kalau sanggup finansial pikirin anak,fear
alhamdulillah listrik nyala warga takziah diam almarhum warga yang wafat terima kasih username username username cc username username url,happy
buat kotor jadi hati bersih kotor hati jernih allamah thabathabai,sadness
satpam komplek memang perhati sekali nanyain pulang jam atas jam malam motor kunjung nangkring teras,happy
paksa sih kerudung sd sayang mama kelas bentar lulus daripada beli baju,happy
yah tuh suka namjoon karena cakap karena personality talent kalau yang jatuh cinta namjoon coba tonton solo vlive pakai pajama ryan jatuh cinta,love
username username habis kak anak anak anak sekolah blablabla lewat kak good luck,sadness
baik sembari nikmat hidang performance oppa ganteng nih ayo tepuk tangan riah,happy
tooosssssssss bangetttt huhu kenal suara kali pas ostnya man from the star sumpah langsung jatuh cinta,love
bosan dengar suara rosa dengar nyanyi asa sayang baik yaampun sayang idola kaya cinta her so much,love
tidur tidur bangun tidur yaa mirip rasa aneh enak hati bawa istighfar saja bangun tidur mirip sedih mirip mikir puguh sangat coba,sadness
bong luh terima kasih anies sandi karena jalanin ide program ahok dibully curiga luh orang memang bisa ngebully saja,anger
kali liat mino tertawa senyum ikut senyum semangat song mino we will always be with you,love
kalau noleh ingat senyum bilang dalam hati hilang apa yang hilang orang sayang,happy
muka tidak cari akan muka bukti kerja lahhh onoh cari muka nya tua saja url,anger
sebut yang pas pasang muda anak tinggal rumah orangtua cewek anak dijagain ibu selagi kerja eh pas lebaran tinggal rumah mertua solat ied sungkem moga pahala yang kasih ibu woi anak sadar kek,anger
baring nyaman foto sayang eeaaaa maafefekstress efekldr efeklaparjuga url,love
logika saja tweetnya muter muter situ saja pakai banding nikita mirzani dp yaelah kecoak terbang url,anger
username yang dipermasalahakan tentang kelola dana zakat gub seblm tentang kelola yang mungkin yang url,anger
enggaaaaaaa karena sayang tidak pandang umur karena akan bucinin pasang tua muda nya akan ikutin terussd,love
hm kadang analisis takut bablas halu lelah duga duga soonhoon mah asli saja imajinasi,fear
kira lapor yang tulis institusi internasional tuh padat isi ya coy isi ngaco logis data benar tafsir tidak,sadness
sekali pas final worldcup pulang ngajinya cepat biar nonton tanding final tv abis sholat isya re run amp,happy
pohon plastik tong sampah yang tarik perhati perhati sampah cari konten status nyinyir sumbangsih hadap bersih mudah jari status nyinyir banding balik dengan niat nyata hidup batas kuota,anger
username naomi sayang cinta sama mohon terima cinta yang tulus dari hati yang tedalam cinta url,love
foto instagram lupa password instanya buka salah perintah instagram pakai password tuh lupa begoloe,anger
kerja kantor malang rejeki seksi sibuk untuk teman teman yang mudik malang taun mesti pulang rejeki rejeki yang susah nilai pakai nominal gaji gede apa alhamdulillah,happy
bagi cita raih fokus usaha terus kerja laahh yang nmanya kerja mesti harus ngantor absen pagi,happy
username username terima kaaih kwik pikir saya pribadi trm kasih d pada forum begitu y dengan yang d sampaikn sarumpait,happy
fans kpop dada ya mending lisa gakusah kesini saja gin tanpa promosi banyak yang datang fanmeetingnya lisa ksel kak liat username,anger
yeeeaaayyy lebaran mamak klaten alhamdulillah swiss belboutique yogyakarta in gondokusuman daerah istimewa yogyakarta,happy
serius bingung maksud and tuju orang yang suka ngelempar kereta batu sakit orang kalau kena kaca n pecah sakit jiwa kali yak,anger
jne jnt pakai kirim paket beli olshop jastip kota beda pulau maksimal pakai mobil susah cari alamat bingung tidak bisa masuk kompleks gang malam bain jalan rumah paket kirim dengan,happy
ai move to thamrin yekan karena bosan sama tanabang yang baju nya baik asa eh masuk thamrin basement isi nya batik sangat,sadness
produce versi indonesia latih dance agnes monica bisma smash cinta laura vocal bertha mas anang bunda maya rap younglex soimah mc irfan hakim gilang ramzi ayu dewi excited neh wkwkkwkwk,happy
btw jalan jakarta bahaya sekali ya jalan lubang apakabar nih dinas pu malang diam diam baee kotamalang savejalanraya malang,anger
takut takut kalau diputusin gimana kalau diselingkuhin gimana kalau diporotin gimana kalau ajak kua gimana gimanaaa gimanaa ya pokok nya takut takut,fear
btw kemarin senin aing tolol sekali ngantri starbucks mbak panggil nama kak roy aing tertawa orang nanaon ieumah keinget roy kiyoshi,sadness
oke cerita euh barusan sekali abis nonton film gratis lupa sponsor perempuan gera begitu temenku tiket gratis dibagiin kota bandung wey keren ya temenku,happy
happy wedding elizasekar moga langgeng kakek nenek wedding weddingparty weddingtradisional adatjawa,happy
umum lulus sujud syukur langsung ambil bunga hampir langsung peluk cium air mata kuasa bendung mom this is my birthday present for,happy
revisi tumpuk badan ngantuk hajar perut makan pop mie goreng ayo siapin stock pop mie kost biar revisi jalan,sadness
gimana rakyat sejahtera jatengdaruratkorupsi jatengdaruratkorupsi jatengdaruratkorupsi jatengdaruratkorupsi jatengdaruratkorupsi jatengdaruratkorupsi jatengdaruratkorupsi jatengdaruratkorupsi jatengdaruratkorupsi jatengdaruratkorupsi url,anger
buka puasa minum makan goreng terus malam makan bakso cabe rawit sendok makan abis perut langsung lilit,sadness
username username username demokrasi mundur karena bebas ekspres terus pantau kuasa,sadness
saat daya kuasa sempurna ku percaya mukjizat nyata karena kuat roh yatuhan ku doa mukjizat nyata,love
cepat sekali pesan langsung terima kasih ya mas username koleksi pustaka fakultas psikologi univ pancasila,happy
