tweet,label
username it claims to be ganti pet soc gitulo mas yang bikin curiga update medsos takut hoax,fear
i cium bibir you you cium bibir i nescaya satu lantas cinta semi,love
minggu asa rahasia kabar angin cemas utus rindu temu kamar smith sajak poem hujan senja rindu temu,sadness
tft nur indah wkwkwk senang y d,happy
sial haha galau we hehe sana stres div,sadness
kasih sayang mu tiada tepi lupa mu salah tangan mu terima yang hina bodoh,love
minggu kabar wkwkwkwk aku sibuk urus rapot ijazah anak tanya kabar minggu sahabat,sadness
ku cerita kelak anak anak cinta inspirasi habis meeting tibatibacinta tibatibakangensuami tibatiba cerita orangyangkucintai jakarta url,love
untung suda temu cowok yang sayang sangat sama dengan bobrok yang lebih kurang gin tidak bisa ngungkapin lagi syukur syukur syukur,happy
mimpin bupati tasik saja gubernur aduh kang tuh kabupaten tasik oge pr akang masyarakat tidap puas kerja akang gubernur cing atuh mikil,anger
bule persepsi normal niat leceh pikir yang bikin orang indonesia remeh bule orang tipe bule foto ku kasar kasar url,anger
username selamat ultah kak renoo wkwkw moga temu kelompok kalau reno gppa deh moga bahagia sejahtera dek oza hehehe,happy
revisi teliti lapang bab data salah hotel jogja yang dipermasalahin dosen uji jogja nanyain data kek begitu saja plus informanya tidak bisa hubungin lari tanggung,anger
permen jahe yang kenyal suka permen sugus nyetock permen sugus kulkas suka sugus purple grape zaman mas tk ubah ngangenin,happy
coba bikin pudding coba salah bikin yang bikin jelly nutrijell coba bikin lap jelly plain coba bikin lap nyampur karena keras salah dosa sayang,sadness
batas yang ajar deras hadap mudah jalan cerita batas ambil semangat hati yang percaya tuntun langkah pulang,sadness
ribu kosa hafal lancar baca jurnal moga biasa usaha disni,sadness
foto posting salah akun instagram milik bisnis transportasi kapal laut izin cantum si milik karya,anger
sepakat username sesat orang larang sholat bangun diri kafir salah satu gereja banyak nonton mak lampir lindung allaah swt,anger
nama orang sirik dengki yah begitu deh sekarang mah hidup harap tuhan yesus kasihan sama saja karena hidup saja singkat gin jahat sama orang orang pada jahat sama ingin pindah kanada saja bilang ngayal tinggi omg very confused me,anger
sayang sekali orang moga sehat bahagia limpah rezeki jodoh yang see in another trip my loves url,love
self titled bin idris mas haikal cs jago sangat bikin ambience nada sigmun album kaget lagu sama ambience mv nya benar persis sama yang bayangin pas dengar lagu keren suka lagu wangi calm water rebah url,happy
buka hati hapus trauma bahagia sama drama tangis air mata duka percaya kotak buka kotak isi tawa canda agam cerita url,love
teliti ku orang yang susah nasehatin orang yang jatuh cinta sudah dibilangin ajaaaa bicara begitu gin ekstra sabar,anger
username tolong kab bekas benah tata kelola jalan raya daerah nota bene celaka yang merenggunt nyawa tetangga kan jalan rusak proyek yang rusak jalan url,sadness
runtuh ego mudah kasih lembut pecah keras hati untung milik,love
teriak nama deras hujan pandang jauh doa hening malam cinta diam tahan,love
bilang kesini pada khawatir votenya trainees bagus pada bingung vote kecuali yang dari fans trainee sebut tebak yang debut,fear
kalau sih presiden kalau kualitas gantung kelompok orang ya event aksi aksi begitu deh hehe url,sadness
warga jalan daerah rusak parah tolong baik perintah celaka gara gara jalan rusak warga perintah tunggu celaka,anger
please help bagaimana leave grup yang isi orang teman deket kampus deket im faking it they re so toxic niru yang laku,anger
kabar sayang,sadness
ku sadar pilih ku sama jalan semangat indah yang ku harap buruk yang ku bayang ku diri jalan penuh warna yang ngerti pst nyanyi,happy
anjiir via vallen digituin sama nih orang casually cuma bilang are angry hmm memang kaya begitu biasa sih orang negara eropa,anger
greget asa gue yang gasabaran tpnya geh yah huhu tidak bisa sabar belum update sama shoppe username,anger
waris anak yang jabat jemput akomodasi anak negeri waris yang anak,anger
moga dorong niat semai cinta rumah rumah allah hantar bahagia hakiki allah subhanahu ta ala url,love
kadang capek tahan hati blaming ngatain super bodoh mental tempe risol asa goreng yang ampas ampas begitu gimanapun keras usaha,sadness
icut skip skip seram gelaaaa malam abis jejeritan langsung lompat kamar umi tidur umi,fear
sayang insan sayang bahagia hormat insan sayang makna tiada sayang tiada hormat,love
teman teman kuliah bidang sehat sih rasa insecure contoh gin kadang rasa was was begitu masa dokter yang capable,fear
username muak tidak pasti hukum rezim hukum keadilaan pasti ketidakpastian,anger
putus pergi takut goyah hati takut teman teman sedih pilih rindu edinburgh castle old town princess castle calton hill,fear
otomatis lahh marah jelasin teman sedikit niat ngerebut pacar teman keak cowok saja hih,anger
tuhan terima kasih sudah kirim orang yang saya bantu ajar terus saya orang yang brnilai milik generosity mindset,happy
terima kasih terima kash tuhan crew dancers sponsor media partner dn yang dukung sukses acara dn terima kash audience yang datang,happy
spam nihh indosat username ku nasehat yang anjur mimin yang balas twit sambat hitung sms jam pacar saja posesif gin lhoo,anger
emak kate emak kate perhati sekali anak anak sekali emakku nongol grup semangat ya mak sehat sayang emak,love
serioulsy speak up leceh jahat julid cewek buset deh komennya hancur hancur sekali,anger
username sekolah pangan kak hihi senang kaaan kelas mirip begitu kak healing sangat sih jaaah salfook wggwgwgw hooh kak hotel yang cari kak dresssing salad gilingaaaan kasta sangat kemb,happy
senda gurau berhappy happy sosial dilink kena musibah bakar semangat crew owner gapuro,sadness
sebucin tulus sayang sama maaf fakeworld asa it s a real sayang ya sayang senang ya senang sedih ya sedih coba gimana main fakewolrd pakai asa yang real,love
oldmoneygakngerasain minum aqua gelas terus gelas plastik selipin ban sepeda pancal biar pas jalan bunyi kaya knalpot,happy
han makasih hanifa,happy
non jerawat oles pakai obat adik ya biar cepat ilang haduh dok gimana hilang obat ketemu doi dok hlah begitu nama jerawat rindu d,sadness
tidak bisa tidur males bongkarin tidur pakai jeans harap pagi pagi langsung bus yang kos koper malang dengan kudu nang takkusangka travel agent yang busyuuk,sadness
naif bicara patah hati munafik luka pilih untuk meni masih bulu kuduk merinding pikir laki masih begitu seram hati sesak percaya setia cinta mati,fear
me manage nih harus benar filter yang prioritas kalau management nya oke hidup jadilebihbaik,sadness
sumpah tadu tidur jam barusan bangun gara gara mimpi kejar setan mimpi kejar miss k ngerti nya bagaimana yang ingat,fear
kabar tuduh chat mesum imam habib rizieq henti mohon bantu doa moga moga suci ramadhan buka mata hati yang sidik amin,fear
kalau anak sd pakai buku tulis kudu sampul coklat binder file keren repot sampul sampul bas buku,happy
rabu anakbujangku selesai tempuh didik tk bhakti bakauheni eit piala jugak hehehe,happy
username username nasib cash back rp pending mohon informasi nya url,fear
kadang rezeki diitung selalu saja yang investasi sosial pjg daftar timbang rasional nya niat lagipula kepada anjur sama rasulullah,happy
curvanordpersija curvasudpersija rojali asukabeh lemah level jak ojok lali keset username username username url,anger
salah cari benar bijak basis suporter tambah provokator yang anjing pantangmunsur jakmania,anger
selamat lapar ya pop mie sob enak bikin nagih bikin baper ayo nyetok pop mie biar seru url,happy
sepakat sesat orang semua laksana sholat salah satu bangun diri kafir salah satu gereja lindung allaah swt goda setan kutuk,anger
senang saja digodain anak ngebayangin qasidahan syair tweet mirip iklan yang viral hahaha url,happy
tunggu comeback tunggu ot insya allah stay exoplanet exo exo comingsoon theelyxion dot weareoneexo url,love
sartre sadar si pr hidup dipungkiri sartre banyak pengaruh pikir percaya tuhan,fear
lagi negara transparan informasi bikin njlimet ae hidup orang misqin nih jurnal bayar dihack jurnal buat jahat adik bang,anger
jadi islam ya islam tambah rang salah pilih guru halal musik rokok riba,anger
juli anak perempuan kakek upacara ngaben singaraja april hilang anak kandung desember suami,sadness
pas buka pengem sekali makan yang beda niat makan mie aceh or nasi bebek pas jalan nya k bbs makan nasi ma pindang n urab kadang nafsu kalah ekonomi,sadness
innalillahi wainna ilaihi roji un undang dasuki salah dosen baik pulang semangat tiru kenal,sadness
bulan x putus jadi labil ki bentar marah deh,sadness
ramadan hai tweeps cerita nih yah ramadan penuh berkah kali ramadan situasi kesan untuk pribadi hari ramadan ajak siar studio yayasan masy muslim freeport indo,happy
lovelaws tt paham mbak gitaris warpaint keren sekali dengar album mirip exposing her romantic side nya begitu jir hasil sekali vibe nya fierce vurnerable seducing at the same time suka lagu cinta leaks sama i ve been fine url,happy
untukumu wanita yang fikrikan bahagia dengan tambah usia mu sayang moga sehat moga jaga iman islam jaga bahagia kasih tenang karena cinta dalam diam lagi selamat tambah usia cinta hdpku,love
sayang akuuuu gede sekali sih kamuuuu asa ya asa kemarin lahir sekarang gede saja bawel sekali,love
minggu suka bolos gereja karena nobar power rmarahs rumah teman rumah penuh kadang dengar tidak bisa liat film miris oldmoneygakngerasain,sadness
liv lupa ingat ya kalau keluh terus liv lupa ingat ya kalau positive vibe dunia nyata jarang ya,fear
sadar sekian manusia cipta allaah swt lindung allaah swt goda setan kutuk url,fear
konyol sangat mbak komentar main ignore saja begitu sepele sekali nyaman publish biar kasih ajar orang yang niat goda biar nerusin niat ingin permaluin reminder bua,anger
aa gervan sayang lupa senyum yah biar ganteng jatuh cinta ehehe,love
wanita tatap pria wajah jatuh cinta,love
presiden biar kelompok bangkang pancasila nkri hidup republik lawan username username username username url,anger
benar saya naksir yang coklat waktu stock kosong t t karena ingin tahu parah sama sound headphone milik kuat beli yang stocknya saja jodoh steel,happy
username takut jalan ramai nyali cepat ciut kepepettttt sekali paksain ya kaku begitu,fear
jauh lihat bahagia sayang cinta,love
c episode sayang trainee kek ngeharep debut saja begitu lolos bisa now i feel like they all deserve that,love
hahaha harus wahyu setan alloh username username username username username url,anger
username ijin min barusan kirim gosend pakai gopay dapat driver pas deket posisi saya klik ambil kirim gopay saya potong barang belum ambil,sadness
hahhaha yang bela takut masuk sorga fakta logika pikir waras kalau salah kabur kecut padahal yang bela bejuta yang goblog url,anger
prof username mohon share cerita lengkap foto yang jepret salat maghrib gereja ayam pniel kemarin biar informasi yang potong potong terima kasih prof,fear
level kangen tinggi cewek suka marah kalau marah kangen kangen sayang cowok kadang peka,sadness
susun panitia inagurasi ospek jurus porangkar sakit kepala mana letak tenang tiga yaallah mana,sadness
cinta aneh usaha hapus hati muncul pikir,love
cinta anggap wujud hidup cinta sayang coba lindung jalan kisah ajar putus tegas sungkan nyaman teman kasih sayang baik,love
jaman harga komoditi booming harga minyak bumi banding apple to apple dengan tumbuh segitu proyek mangkrak url,anger
liat benar benar dengerin seksama nissa sabyan nya lagi daun asli rusak rusak suara flawless bening benerrr kaya gelas beling abis cuci pakai s unlight bersih sinar begitu deh heran,love
min rakyat indonesia harap nya tinggal tni lihat serang kantor media unsur pidana hina presiden indonesia sah lucu lucu an tni url,anger
jaman orba kalau lebaran gin ajak pasar beli baju yang suka kebel nawarnya mentok sangat biasa anak ekonomi tentu,sadness
nikmat dunia indah cinta indah mimpi erat silaturahim insyaallah bawa mati teman prof rifai selamat malam tweeps lupa doa tidur,happy
hore hihi moment ye capai sih senang,happy
the greatest showman film musikal isi film nyanyi pribadi suka sangat genre kek jam nonton tuh rasa ikut nyanyi nari,happy
lemah daddy an mirip bri bikin sayang kalau gin cerita hilang url,love
liat trailer kagum ide madu film laga nusantara tampil wild west janji kreatif harap saji istimewa,happy
tanya yang hutang ulang ulang sih tagih jawab neraka no yang,fear
yang tanya nawarin kenapa sih kerja bank sih daftar pns blablablaaahhh jawab sederhana tarik paksa makasih,anger
gede gampang filter teman kalau ajak jalan ribet tanya alas ya ajak,anger
username saya percaya ktp karena saya percaya anggar e ktp korupsi anggota dewan yang hormat pura pura url,anger
hapy weding sri rori keluarga tuhan god bles us,happy
username username sabar hehehee tidak tidak tahu diceramahin lebar sangka sayang allah dan lain,sadness
username heee kemarin ngeliat hoak tetang pohon plastik kali dari akun ygdisebarkan facebook nol skaligus nonjok muka junjung sdr terima kasih,anger
kalau indonesia lena gomez dinyinyirin orang tabah sekali jagain jodoh orang putus nyambung justin bieber eh justin,sadness
heran si orang stres berkeliarab d salemba minggu yang abis anak cowok kaya begitu yang betah d salemba memang si rt rw cepat nanggepin keluh warga,fear
tuju buang sampah sesuai jenis nya mirip sampah daur ulang sampah yang daur ulang lifeatapril url,happy
pria jahat istri cantik rumah pergi cari pria istri sayang mati moga kelak aku lelaki yang cinta cinta ayah ibu trimksh ayah tlah pilih mnjdi istri,love
curhat saja deh tuh suka kpop suka minder teman rl teman ku yang suka kpop kadang risih teman yang bicara stop korea pls shel,fear
waktu jaman sekolah laki yang suka boro nanggepin yang malu nya ampun sampai tuh laki d musuhin bocah jman sekarang jomblo bentar galau nya ampun bagaimana kalau kaya saya yang jomblo oldmoneygakngerasain,sadness
bahagia bahagia tengah keluarga,happy
memang benar fromm cinta sempurna dasar knowledge respect responsibility care liat keluarga belo ncip sekala dido utuh sekali mereka healty mental yang efek pintar aktif si sekala,love
bukber dompet protes bukber terus isi isi dompet gendutin badan kurusin balik oke sip besok ku lembur baghai qhuda,sadness
asik begitu ya kenal yang sejarah sejarah ato bahas filsafat filsafat bahas fallen angel pokok conspiracy theory and suka teather darah seni deh teman kaya begitu akan keep pokok lol,happy
mu gaes tadu habis pergi pakai bedak lipstik saja sih bersihin muka nya pakai mc viva pixy saja terus habis itu pakai toner viva tidak apa ya cuci muka pakai fw takut kamar mandi jam gin,fear
senyum hidup sempurna syukur yang tuhan ku,happy
guna pit against another women yang laku senang wanita punya hati empati leceh instead of lawan anggap senang shame on them,anger
lokasi segara ana tutup mangrove kalau siang sekolah kerendem air laut anak anak sekolah pulang copot sepatu miris ngeliatnya nampar pribadi url,sadness
bahagia keliling orang orangtua keluarga pasang teman nikmat yang indah banding materi keliling orang terimakasih yang maha,happy
fukudako bal ramen baik lidah selera enak ramennya puas porsi kenyang,happy
baca pesan whatsapp pikir itu kadang suka orang sadar kadang si memang maklum angelic,sadness
jujur saja yah goblok gila harus sadar lingkar setan hidup banyak saudara dengki n jahat sama kuat n sepupu sial cln huni neraka si lina n laki n si lita najiiiis sial,anger
selamat ulang tehskikuu sayang username beda yang mah aing kucel hideung enamah yah hahaha url,happy
username suka skinship sama pacar peluk cium nangkring paha duduk pangku ya begitu deh wkwkw sama teman cwek canggung nyahah,happy
viralkan nanti oposisi nyinyir kejang sakit jantung sakit hati kronis sulit sembuh,fear
happy mansive daddy saja untung sekali dapat daddy makasih jalan daddy senyum sayaaangg sekali daddy ngerti sayang nya gimana inti i cinta you,love
username jam gin sinyal bagus aka buruk mirip d siang kualitas sinyal smkin kacauu,anger
iyaa untungnyaaa manta deh kemarin sepupu pulang bal disaranin pakai pesawat mobilny tinggal jogja abis nyebrangnya coy horor,fear
bicara pokok sayang longguo,love
username yaudah ignore mba via vallen saja aneh elu bikin perempuan berani speak up sama rasain mens empati sama,anger
suka senang nama maling senang maling digebukin bonyok sekali bakar bunuh,sadness
bimbing rupa rupa macam bimbing bikin grup bimbing tidak pernah ada bimbing h progress baca coret dengar simpul bagaimana bilang dateline skripsi minggu,sadness
omg parah benar insom belum ngantuk mata masih seger saja pikir lagi kacau sih kayak gin efek pikir lagi tegang n hawa suntuk kesal kemarin hiiiiks,sadness
bikin status galau ig sekali bikin yang kepoooo pada sotoyyy langsung jadi bahan gosip sok pangnyaho na weh kesal efeklgdatengtamu,anger
ritual kalau tidur nyanyi lagu sayang kakak ani sayang mamak sayang bapa sayang oppung sayang abang gio sayang tua gio sayang tua winda nyebutin anggota keluarga nama duluan dek,love
rumah badan melar coba saja dikosan makan buah buka saja deh nurunin berat badan rantau balik nimbun lemak,sadness
selamat tetas bulat versi korea kuhhh exols sayang kamuuuuuuuuuu hu bulat,love
cinta cinta ali baring tidur ganti rasulullah saw kasur nabi kelompok orang kumpul bunuh rasulullah saw tewas kasur,love
untuk pasang ajak bicara erti maklum sembunyi definisi romantis versi,love
duh teman kantor tukar shift dada nelpon jam nelpon bak bik buk jelasss masihh saja teman yang tolol makan,anger
keinget ngejar saja annex bain toefl jakarta siap samsek ngirim hasil toefl bandung ngumpulin berkas dan lain dan lain,sadness
aduh cewek yang pikir jahat jari jari jahat nikmat heh mbak memang nyanyi dangdut auto lonte lonte kena sexual harassment mbaaaak,anger
mbir dibilangin tidak ada orang juang hidup diri gausa harap ya biar kecewa,sadness
username username makan kerupuk berisik pakai celana pas tidur mata ngantuk tetap asik soal sahur username username inisahurtiketcomharike,happy
username mak lampir dibully berantas nyamuk tuntas gagal selamat sang kuasa tampil olah gicuuuuu aaahhhh,anger
username cemooh orang harga harga balap senior,anger
username takut fitnah memang benar huhu yaudah macem macem internet diblacklist holcim asli,fear
seduh kopi air mata yang panas hasil kepul manis kenang pahit tinggal,sadness
omelette mie ter pas sekali texturenya pas hancur renyah gigit lembut pas kunyah pas greasy matengnya pas pas ketemu waktu pas sih url,sadness
brasil kandidat kuat juara hajar jerman neymar absen daya serang turun thiago silva absen sisa david luiz mana bawa orang main main bawa rusia kunci neymar yang haus gelar,anger
username nama hijrah orang pindah tempat yang kalau rizieq orang yang buat buruk lari hijrah negara orang,anger
obat ngantri dokter kek ngantri sembako benar,anger
beli kolak buka puasa habis tadu tidak buang sayang dibesokin takut basi kita nyokap berkah suap dengan segenap jiwa raga habis kolak sebut,fear
takut kalau tani terus jauh terus nyindir terus ku enak malas ngampus akibat,fear
done lukis teakhir slese kemarin bungkus bawa pulang moga kenan like this,happy
terima kasih teman hmj d awat stikes al irsyad cilacap bagi bahagia mbah kakung mbah putri username url,happy
hati harap allah timpa atas pedih harap allah cemburu hati harap allah halang perkara harap nya,sadness
kasar bilang kalau pakai lagi dengerin musik yang keluar selalu musik shinhwa bikin joget wkwk xd nama autoreaction sih xd url,happy
citra ldrnya mahasiswa dar labuh tanggal tua transfer orangtua wartel pinggir jatos dar kumpul ber wifi atas kostan mahasiswi,happy
username iya film action nih kemarin abdi setan banyak tuh film horror kesal kali liat trailer belum film bikin takut ku nonton malam suka parno wkwkwkwkwk,fear
rencana roadtrip uci ketemu kailani johnson tidak jadi dua sepupu nimbrung film kasih pandang indah rote jakarta banyuwangi yang main sam lucu sekali sherina url,happy
tidak suka sih gondok dongkol mangkel saja kaget meniqaaa moga insyafmu abal abal ya mas ha ha ha moga alim benar ingat ya tentang habluminallah,anger
sih memang saja ajak ekor mcflurry kalau hujan gin beli hangat eh kata beli hujan canda toleh tertawa,happy
gp hitam manis laku ngakuin pacar orang yeh,happy
username ngeliat rp cewek chara followers nya pribadi bawa chara bikin jatuh cinta nya,love
moga cangkir toraja teman semangat yuk aktivitas,happy
hidup kejam anggap hidup tarung arena saing berfikir layak tani hidup ya cocok tanam harap takut,fear
username malam tadu sekitar flyover tanjung barat arah ragunan ad gerombol anak muda sotr mohon tindak terimakasih,fear
ya jodoh yuk baik laku biarpum meni,happy
inti seleksi lalu dunia ingattt seleksi alam yang uji mudah sulit,sadness
allah cubit uji allah rindu rindu rintih rindu sujud panjang rindu puji puji allah cemburu karena sayang rindu lelaki,sadness
macet coy menteri bumn,anger
seru wlpun menit brubah atur amin amin nuhun bu gtt ihh enak nyapa ciranjang,happy
happy one fifteenth cofee inet cepat colok kerja inter damai pantes betah coffee shop,happy
kemarin sholat dzuhur atas genteng berisik sangat suara burung das uncuing serius burung suara kencang sangat ngebangunin lagi tidur siang sore tadu mama ngabarin kalau anak tetangga tinggal ya allah takut sekali,fear
terima kasih username pelita televisi negeri channel kiam gencar usaha suguh tayang gelap ikut url,happy
username username username br goa ya presiden ancam bunuh dikacungin ma bicah viral video nya mungkin kalau parah,anger
nikmat denyut jantung rasa hirup nafas perlahan sadar mata buka tutup rasa nikmat renung tutup mata helai nafas senyum tubuh akan layang lepas nikmat nya,happy
barusan bahas ribut sih keluarin uneg saja diam karena tidak bisa ngapain lagi sih kasihan rasa salah ya tidak bisa ngapain sih sibuk,sadness
impi tulis pandang doa wujud mimpi baitullah yakin tanah suci,love
selamat kerja p ganjar username jadi jateng nggayeng yeng nih gowes bareng raya nih dengan gowes selamat selamat selamat,happy
oh kirain beli wkwkwk maksud tuh ongkos gojek yhaa aduuu cian tidak apa beli orang eh makan kalau dikasihin lagi orang bagus mandiri daripada tetap manja,happy
tidak beranda andai hidup dunia real tidak film radit and jani pola pikir logis saja sih,anger
jatuh percaya ajar bangkit,sadness
debat panas rocky gerung vs ruhut sitompul ros ilc indonesia lawy url username gimana bilang jokowi kacung om username diam,anger
s sulit gapai anugrah jalan mudah s ya allah dunia engkau cipta,sadness
benar sayang tiap kali papas,love
acara tahun sanusi family wajah anak cucu cucu menantu cicit rempong moga tahun kompak lengkap juli url anger wkwkwkw seperti minggu ledak terus memang orang goblok memang tidak ada otak nya yang sabar sadness sabar ya boy selalu d hina tmanku padahal salah selalu d bipang manusia lastik tpikan manusia plastik teman tdak mrnghinamu boy hwaiting boy,happy
username username hai rakyat geruduglah kantor media pukul wartawannya sila langgar hukum username,anger
netizen indonesia banyak eks anggap dunia maya panggung kadang peran peran orang bijak kadang pedas hakim,anger
makasih ya tahan rumah jarang aktif sayang roro pakai sekali,love
asik bicara teman teman sma bersit pikir gimana ya alam kubur teman teman fana seram sekali pikir,fear
username username username username cita cita jongos pola pikir batas jongos dengan kapasitas otak mumpuni unt tampung berfikir yang tulis username,anger
ikhlas iya buk ikhlas kesini sadar ikhlas berat selesai iyaa,sadness
purnama tunggu kerja keras insan tvri lepas opini disclaimer jawab semangat wtp insya allah,happy
ya lagi parnoan gede saja halu halu takut sitin begitu bayang bayang tadu beraniin kemarin mandi dalam lagi halang bayangin si seram bunyi asli lemas merinding sangat padahal yang aneh aneh n langsung ngibrit,fear
i swear you kalau ngechat ko koh iko ku balas cepat kilat dibales kesal yak yak kalau dichat begitu pikir mana dapaya ngilang iko sugus sebal,anger
username username waketum gerindrong dongo instagram hapus langgar hukum foto depan kabah langgar hukum url,anger
happy birthday to us username and happy th anniv wkwkwk bentar putus huhu cari pacar url,happy
ya gagal kakak bimbing adik saat alam hidup orang motivasi hasil bangkit kuat salah salah,sadness
ig post foto terus bilang alay post tulis bilang galau terus save bikin whatsapp story kalau marah sama gebetan sak ro otw mbalang kalem,sadness
besok uas statmat doa uas xixixi syukur negeri damai sempat cari ilmu jenjang yang coba kalau indonesia kek suriah seleha leha,happy
gila takut sekali kaget begitu loncat lari kaget bat hufh abis luar teman satpam satpam tanya memang bilang pintu kunci alas saja takut kalau ngomogin langsung gais hufh end,fear
mba pps tuh mba ulfa rasa sebentar sebentar sih senin berangkat bikin khawatir saja t t,fear
cerita a cerita b cerita dengan c harap hubung suami isteri itu halal huhu bawa main cerai ini bahaya,fear
iyaaa suka bahasa begitu btw rekomendasi ff nct yang bagus yang complete tapi klopun belum yang updatenya cepat wkwk,happy
username min awat transjakarta metro mini basway mobil nya masalah,anger
yang bilang koalisi syarat koar jatah menteri nyata parpol yang non koalisi bedol dengan kasih jbtn menteri,anger
username username sukarno yang bubar masyumi lai jaleh dek ang jiang masyumi vs pki sukarno bela pki zaman si jok bos mega anak sukarno bubar hati alas bubar masyumi,anger
username rumah kue tap aku liat kemarin karena kerja hahhahha ketemu entah macem hahhahha lelah nyungsep d fansnya wkkwkkw,happy
semester kalau gasalah teman teman deket saya tidak ada saya kasih saya benar benar mendem takut sebar,fear
pilih cerita izin tinta habis buku tutup buku tutup gegas pamit,sadness
apasih bagus tlvnan gery nyolotan mele wkwk heran h,happy
username username rejimpanik ulama kriminalisasi saudara bacok rumah sahabat lempar bom mobil bunda bakar mau sih takut mundur gantipresiden,anger
